{"actor_id":"actor-neutral-1","capabilities":["execution_binding.targeted.v1"],"component_manifest_sha256":"sha256:bbbbbbbbbbbbbbbbbbbbbbbbbbbbbbbbbbbbbbbbbbbbbbbbbbbbbbbbbbbbbbbb","protocol":"workspace.v1","realm_id":"realm-neutral-1","schema_digest":"sha256:aaaaaaaaaaaaaaaaaaaaaaaaaaaaaaaaaaaaaaaaaaaaaaaaaaaaaaaaaaaaaaaa","scopes":["project:read","project:write"],"session_id":"session-neutral-1"}
